No.     Time        Source                Destination           Protocol Length Info
     23 16.543163   10.0.2.15             74.125.230.206        HTTP     335    GET /complete/search?output=toolbar&hl=en&q=tom HTTP/1.0 

Frame 23: 335 bytes on wire (2680 bits), 335 bytes captured (2680 bits)
Ethernet II, Src: CadmusCo_96:83:18 (08:00:27:96:83:18), Dst: RealtekU_12:35:02 (52:54:00:12:35:02)
Internet Protocol Version 4, Src: 10.0.2.15 (10.0.2.15), Dst: 74.125.230.206 (74.125.230.206)
Transmission Control Protocol, Src Port: optima-vnet (1051), Dst Port: http (80), Seq: 1, Ack: 1, Len: 281
Hypertext Transfer Protocol
    GET /complete/search?output=toolbar&hl=en&q=tom HTTP/1.0\r\n
    Accept: image/gif, image/x-xbitmap, image/jpeg, image/pjpeg, */*\r\n
    User-Agent: Mozilla/4.0 (compatible; MSIE 8.0; Windows NT 6.1; WOW64; Trident/4.0; SLCC2; Media Center PC 6.0; InfoPath.2; MS-RTC LM 8)\r\n
    Host: google.com\r\n
    \r\n
    [Full request URI: http://google.com/complete/search?output=toolbar&hl=en&q=tom]

No.     Time        Source                Destination           Protocol Length Info
     28 16.593236   74.125.230.206        10.0.2.15             HTTP/XML 60     HTTP/1.0 200 OK 

Frame 28: 60 bytes on wire (480 bits), 60 bytes captured (480 bits)
Ethernet II, Src: RealtekU_12:35:02 (52:54:00:12:35:02), Dst: CadmusCo_96:83:18 (08:00:27:96:83:18)
Internet Protocol Version 4, Src: 74.125.230.206 (74.125.230.206), Dst: 10.0.2.15 (10.0.2.15)
Transmission Control Protocol, Src Port: http (80), Dst Port: optima-vnet (1051), Seq: 1456, Ack: 282, Len: 0
[3 Reassembled TCP Segments (1455 bytes): #25(1418), #26(37), #28(0)]
Hypertext Transfer Protocol
    HTTP/1.0 200 OK\r\n
    Date: Tue, 20 Mar 2012 02:38:16 GMT\r\n
    Expires: Tue, 20 Mar 2012 02:38:16 GMT\r\n
    Cache-Control: private, max-age=3600\r\n
    Content-Type: text/xml; charset=UTF-8\r\n
    Set-Cookie: PREF=ID=84da648c2cd6ed52:FF=0:TM=1332211095:LM=1332211096:S=CpQRmowLqr2Z6U90; expires=Thu, 20-Mar-2014 02:38:16 GMT; path=/; domain=.google.com\r\n
    Server: gws\r\n
    X-XSS-Protection: 1; mode=block\r\n
    X-Frame-Options: SAMEORIGIN\r\n
    \r\n
eXtensible Markup Language
    <?xml
    <toplevel>

No.     Time        Source                Destination           Protocol Length Info
     35 16.754306   10.0.2.15             74.125.230.206        HTTP     302    GET /complete/search?output=toolbar&hl=en&q=jerry HTTP/1.0 

Frame 35: 302 bytes on wire (2416 bits), 302 bytes captured (2416 bits)
Ethernet II, Src: CadmusCo_96:83:18 (08:00:27:96:83:18), Dst: RealtekU_12:35:02 (52:54:00:12:35:02)
Internet Protocol Version 4, Src: 10.0.2.15 (10.0.2.15), Dst: 74.125.230.206 (74.125.230.206)
Transmission Control Protocol, Src Port: ddt (1052), Dst Port: http (80), Seq: 1, Ack: 1, Len: 248
Hypertext Transfer Protocol
    GET /complete/search?output=toolbar&hl=en&q=jerry HTTP/1.0\r\n
    Accept: image/gif, image/x-xbitmap, image/jpeg, image/pjpeg, */*\r\n
    User-Agent: Mozilla/5.0 (Windows; U; Windows NT 6.1; en-GB; rv:1.9.1.3) Gecko/20090824 Firefox/3.5.3\r\n
    Host: google.com\r\n
    \r\n
    [Full request URI: http://google.com/complete/search?output=toolbar&hl=en&q=jerry]

No.     Time        Source                Destination           Protocol Length Info
     40 16.807171   74.125.230.206        10.0.2.15             HTTP/XML 60     HTTP/1.0 200 OK 

Frame 40: 60 bytes on wire (480 bits), 60 bytes captured (480 bits)
Ethernet II, Src: RealtekU_12:35:02 (52:54:00:12:35:02), Dst: CadmusCo_96:83:18 (08:00:27:96:83:18)
Internet Protocol Version 4, Src: 74.125.230.206 (74.125.230.206), Dst: 10.0.2.15 (10.0.2.15)
Transmission Control Protocol, Src Port: http (80), Dst Port: ddt (1052), Seq: 1491, Ack: 249, Len: 0
[3 Reassembled TCP Segments (1490 bytes): #37(1418), #38(72), #40(0)]
Hypertext Transfer Protocol
    HTTP/1.0 200 OK\r\n
    Date: Tue, 20 Mar 2012 02:38:16 GMT\r\n
    Expires: Tue, 20 Mar 2012 02:38:16 GMT\r\n
    Cache-Control: private, max-age=3600\r\n
    Content-Type: text/xml; charset=UTF-8\r\n
    Set-Cookie: PREF=ID=ac1d9fa6568b1324:FF=0:TM=1332211096:LM=1332211096:S=_rjjEvl5XvxOQBj5; expires=Thu, 20-Mar-2014 02:38:16 GMT; path=/; domain=.google.com\r\n
    Server: gws\r\n
    X-XSS-Protection: 1; mode=block\r\n
    X-Frame-Options: SAMEORIGIN\r\n
    \r\n
eXtensible Markup Language
    <?xml
    <toplevel>

No.     Time        Source                Destination           Protocol Length Info
     49 17.324409   10.0.2.15             216.109.126.242       HTTP     311    GET /sg/?output=fxjsonp&nresults=10&command=tom HTTP/1.0 

Frame 49: 311 bytes on wire (2488 bits), 311 bytes captured (2488 bits)
Ethernet II, Src: CadmusCo_96:83:18 (08:00:27:96:83:18), Dst: RealtekU_12:35:02 (52:54:00:12:35:02)
Internet Protocol Version 4, Src: 10.0.2.15 (10.0.2.15), Dst: 216.109.126.242 (216.109.126.242)
Transmission Control Protocol, Src Port: remote-as (1053), Dst Port: http (80), Seq: 1, Ack: 1, Len: 257
Hypertext Transfer Protocol
    GET /sg/?output=fxjsonp&nresults=10&command=tom HTTP/1.0\r\n
    Accept: image/gif, image/x-xbitmap, image/jpeg, image/pjpeg, */*\r\n
    User-Agent: Mozilla/5.0 (Windows; U; Windows NT 6.1; en-GB; rv:1.9.1.3) Gecko/20090824 Firefox/3.5.3\r\n
    Host: sugg.search.yahoo.com\r\n
    \r\n
    [Full request URI: http://sugg.search.yahoo.com/sg/?output=fxjsonp&nresults=10&command=tom]

No.     Time        Source                Destination           Protocol Length Info
     51 17.455310   216.109.126.242       10.0.2.15             HTTP     787    HTTP/1.0 200 OK  (application/javascript)

Frame 51: 787 bytes on wire (6296 bits), 787 bytes captured (6296 bits)
Ethernet II, Src: RealtekU_12:35:02 (52:54:00:12:35:02), Dst: CadmusCo_96:83:18 (08:00:27:96:83:18)
Internet Protocol Version 4, Src: 216.109.126.242 (216.109.126.242), Dst: 10.0.2.15 (10.0.2.15)
Transmission Control Protocol, Src Port: http (80), Dst Port: remote-as (1053), Seq: 1, Ack: 258, Len: 733
Hypertext Transfer Protocol
    HTTP/1.0 200 OK\r\n
    Date: Tue, 20 Mar 2012 02:38:16 GMT\r\n
    Set-Cookie: B=87741u17mfrco&b=3&s=8o; expires=Tue, 21-Mar-2014 20:00:00 GMT; path=/; domain=.yahoo.com\r\n
    P3P: policyref="http://info.yahoo.com/w3c/p3p.xml", CP="CAO DSP COR CUR ADM DEV TAI PSA PSD IVAi IVDi CONi TELo OTPi OUR DELi SAMi OTRi UNRi PUBi IND PHY ONL UNI PUR FIN COM NAV INT DEM CNT STA POL HEA PRE LOC GOV"\r\n
    Content-Length: 167\r\n
        [Content length: 167]
    Expires: Tue, 20 Mar 2012 03:38:16 GMT\r\n
    Vary: Accept-Encoding\r\n
    Content-Type: application/javascript; charset=UTF-8\r\n
    Cache-Control: private\r\n
    Age: 0\r\n
    Server: YTS/1.19.11\r\n
    \r\n
Media Type

No.     Time        Source                Destination           Protocol Length Info
     59 17.715065   10.0.2.15             216.109.126.242       HTTP     338    GET /sg/?output=fxjsonp&nresults=10&command=jerry HTTP/1.0 

Frame 59: 338 bytes on wire (2704 bits), 338 bytes captured (2704 bits)
Ethernet II, Src: CadmusCo_96:83:18 (08:00:27:96:83:18), Dst: RealtekU_12:35:02 (52:54:00:12:35:02)
Internet Protocol Version 4, Src: 10.0.2.15 (10.0.2.15), Dst: 216.109.126.242 (216.109.126.242)
Transmission Control Protocol, Src Port: brvread (1054), Dst Port: http (80), Seq: 1, Ack: 1, Len: 284
Hypertext Transfer Protocol
    GET /sg/?output=fxjsonp&nresults=10&command=jerry HTTP/1.0\r\n
    Accept: image/gif, image/x-xbitmap, image/jpeg, image/pjpeg, */*\r\n
    User-Agent: Mozilla/5.0 (Windows; U; Windows NT 5.1; en-US; rv:1.9.0.14) Gecko/2009082707 Firefox/3.0.14 (.NET CLR 3.5.30729)\r\n
    Host: sugg.search.yahoo.com\r\n
    \r\n
    [Full request URI: http://sugg.search.yahoo.com/sg/?output=fxjsonp&nresults=10&command=jerry]

No.     Time        Source                Destination           Protocol Length Info
     61 17.851013   216.109.126.242       10.0.2.15             HTTP     800    HTTP/1.0 200 OK  (application/javascript)

Frame 61: 800 bytes on wire (6400 bits), 800 bytes captured (6400 bits)
Ethernet II, Src: RealtekU_12:35:02 (52:54:00:12:35:02), Dst: CadmusCo_96:83:18 (08:00:27:96:83:18)
Internet Protocol Version 4, Src: 216.109.126.242 (216.109.126.242), Dst: 10.0.2.15 (10.0.2.15)
Transmission Control Protocol, Src Port: http (80), Dst Port: brvread (1054), Seq: 1, Ack: 285, Len: 746
Hypertext Transfer Protocol
    HTTP/1.0 200 OK\r\n
    Date: Tue, 20 Mar 2012 02:38:17 GMT\r\n
    Set-Cookie: B=001e8j17mfrcp&b=3&s=sb; expires=Tue, 21-Mar-2014 20:00:00 GMT; path=/; domain=.yahoo.com\r\n
    P3P: policyref="http://info.yahoo.com/w3c/p3p.xml", CP="CAO DSP COR CUR ADM DEV TAI PSA PSD IVAi IVDi CONi TELo OTPi OUR DELi SAMi OTRi UNRi PUBi IND PHY ONL UNI PUR FIN COM NAV INT DEM CNT STA POL HEA PRE LOC GOV"\r\n
    Content-Length: 180\r\n
        [Content length: 180]
    Expires: Tue, 20 Mar 2012 03:38:17 GMT\r\n
    Vary: Accept-Encoding\r\n
    Content-Type: application/javascript; charset=UTF-8\r\n
    Cache-Control: private\r\n
    Age: 0\r\n
    Server: YTS/1.19.11\r\n
    \r\n
Media Type

No.     Time        Source                Destination           Protocol Length Info
     71 18.326075   10.0.2.15             207.171.162.173       HTTP     361    GET /search/complete?method=completion&q=tom&search-alias=aps&client=amzn-search-suggestions/9fe582406fb5601f343a84083d78795713c12d68&mkt=1 HTTP/1.0 

Frame 71: 361 bytes on wire (2888 bits), 361 bytes captured (2888 bits)
Ethernet II, Src: CadmusCo_96:83:18 (08:00:27:96:83:18), Dst: RealtekU_12:35:02 (52:54:00:12:35:02)
Internet Protocol Version 4, Src: 10.0.2.15 (10.0.2.15), Dst: 207.171.162.173 (207.171.162.173)
Transmission Control Protocol, Src Port: ansyslmd (1055), Dst Port: http (80), Seq: 1, Ack: 1, Len: 307
Hypertext Transfer Protocol
    GET /search/complete?method=completion&q=tom&search-alias=aps&client=amzn-search-suggestions/9fe582406fb5601f343a84083d78795713c12d68&mkt=1 HTTP/1.0\r\n
    Accept: image/gif, image/x-xbitmap, image/jpeg, image/pjpeg, */*\r\n
    User-Agent: Opera/9.64(Windows NT 5.1; U; en) Presto/2.1.1\r\n
    Host: completion.amazon.com\r\n
    \r\n
    [Full request URI: http://completion.amazon.com/search/complete?method=completion&q=tom&search-alias=aps&client=amzn-search-suggestions/9fe582406fb5601f343a84083d78795713c12d68&mkt=1]

No.     Time        Source                Destination           Protocol Length Info
     74 18.453273   207.171.162.173       10.0.2.15             HTTP     60     HTTP/1.1 200 OK  (text/javascript)

Frame 74: 60 bytes on wire (480 bits), 60 bytes captured (480 bits)
Ethernet II, Src: RealtekU_12:35:02 (52:54:00:12:35:02), Dst: CadmusCo_96:83:18 (08:00:27:96:83:18)
Internet Protocol Version 4, Src: 207.171.162.173 (207.171.162.173), Dst: 10.0.2.15 (10.0.2.15)
Transmission Control Protocol, Src Port: http (80), Dst Port: ansyslmd (1055), Seq: 373, Ack: 308, Len: 0
[2 Reassembled TCP Segments (372 bytes): #73(372), #74(0)]
Hypertext Transfer Protocol
    HTTP/1.1 200 OK\r\n
    Server: Apache-Coyote/1.1\r\n
    Content-Type: text/javascript;charset=UTF-8\r\n
    Date: Tue, 20 Mar 2012 02:38:17 GMT\r\n
    Connection: close\r\n
    \r\n
Line-based text data: text/javascript
    ["tom",["toms","tommy hilfiger","toms shoes","toms shoes womens","tommy","tomtom","tomahawk","tommy hilfiger men","tom clancy","tommee tippee"],[{"nodes":[{"name": "Shoes", "alias": "shoes"}]},{},{},{},{},{},{},{},{},{}],[]]\n

No.     Time        Source                Destination           Protocol Length Info
     81 18.716376   10.0.2.15             207.171.162.173       HTTP     363    GET /search/complete?method=completion&q=jerry&search-alias=aps&client=amzn-search-suggestions/9fe582406fb5601f343a84083d78795713c12d68&mkt=1 HTTP/1.0 

Frame 81: 363 bytes on wire (2904 bits), 363 bytes captured (2904 bits)
Ethernet II, Src: CadmusCo_96:83:18 (08:00:27:96:83:18), Dst: RealtekU_12:35:02 (52:54:00:12:35:02)
Internet Protocol Version 4, Src: 10.0.2.15 (10.0.2.15), Dst: 207.171.162.173 (207.171.162.173)
Transmission Control Protocol, Src Port: vfo (1056), Dst Port: http (80), Seq: 1, Ack: 1, Len: 309
Hypertext Transfer Protocol
    GET /search/complete?method=completion&q=jerry&search-alias=aps&client=amzn-search-suggestions/9fe582406fb5601f343a84083d78795713c12d68&mkt=1 HTTP/1.0\r\n
    Accept: image/gif, image/x-xbitmap, image/jpeg, image/pjpeg, */*\r\n
    User-Agent: Opera/9.64(Windows NT 5.1; U; en) Presto/2.1.1\r\n
    Host: completion.amazon.com\r\n
    \r\n
    [Full request URI: http://completion.amazon.com/search/complete?method=completion&q=jerry&search-alias=aps&client=amzn-search-suggestions/9fe582406fb5601f343a84083d78795713c12d68&mkt=1]

No.     Time        Source                Destination           Protocol Length Info
     84 18.847439   207.171.162.173       10.0.2.15             HTTP     60     HTTP/1.1 200 OK  (text/javascript)

Frame 84: 60 bytes on wire (480 bits), 60 bytes captured (480 bits)
Ethernet II, Src: RealtekU_12:35:02 (52:54:00:12:35:02), Dst: CadmusCo_96:83:18 (08:00:27:96:83:18)
Internet Protocol Version 4, Src: 207.171.162.173 (207.171.162.173), Dst: 10.0.2.15 (10.0.2.15)
Transmission Control Protocol, Src Port: http (80), Dst Port: vfo (1056), Seq: 447, Ack: 310, Len: 0
[2 Reassembled TCP Segments (446 bytes): #83(446), #84(0)]
Hypertext Transfer Protocol
    HTTP/1.1 200 OK\r\n
    Server: Apache-Coyote/1.1\r\n
    Content-Type: text/javascript;charset=UTF-8\r\n
    Date: Tue, 20 Mar 2012 02:38:18 GMT\r\n
    Connection: close\r\n
    \r\n
Line-based text data: text/javascript
    [truncated] ["jerry",["jerry lewis","jerry can","jerry maguire","jerry garcia","jerry bridges","jerry lee lewis","jerry reed","jerry jeff walker","jerry clower","jerry rice jersey"],[{"nodes":[{"name": "Movies & TV", "alias": "movies-tv"},

No.     Time        Source                Destination           Protocol Length Info
     93 19.046849   10.0.2.15             173.194.34.6          HTTP     310    GET /complete/search?client=youtube&hl=en&ds=yt&cp=4&gs_id=l&callback=google.sbox.p0&q=tom HTTP/1.0 

Frame 93: 310 bytes on wire (2480 bits), 310 bytes captured (2480 bits)
Ethernet II, Src: CadmusCo_96:83:18 (08:00:27:96:83:18), Dst: RealtekU_12:35:02 (52:54:00:12:35:02)
Internet Protocol Version 4, Src: 10.0.2.15 (10.0.2.15), Dst: 173.194.34.6 (173.194.34.6)
Transmission Control Protocol, Src Port: startron (1057), Dst Port: http (80), Seq: 1, Ack: 1, Len: 256
Hypertext Transfer Protocol
    GET /complete/search?client=youtube&hl=en&ds=yt&cp=4&gs_id=l&callback=google.sbox.p0&q=tom HTTP/1.0\r\n
    Accept: image/gif, image/x-xbitmap, image/jpeg, image/pjpeg, */*\r\n
    User-Agent: Opera/9.64(Windows NT 5.1; U; en) Presto/2.1.1\r\n
    Host: clients1.google.com\r\n
    \r\n
    [Full request URI: http://clients1.google.com/complete/search?client=youtube&hl=en&ds=yt&cp=4&gs_id=l&callback=google.sbox.p0&q=tom]

No.     Time        Source                Destination           Protocol Length Info
     96 19.103776   173.194.34.6          10.0.2.15             HTTP     60     HTTP/1.0 200 OK  (text/javascript)

Frame 96: 60 bytes on wire (480 bits), 60 bytes captured (480 bits)
Ethernet II, Src: RealtekU_12:35:02 (52:54:00:12:35:02), Dst: CadmusCo_96:83:18 (08:00:27:96:83:18)
Internet Protocol Version 4, Src: 173.194.34.6 (173.194.34.6), Dst: 10.0.2.15 (10.0.2.15)
Transmission Control Protocol, Src Port: http (80), Dst Port: startron (1057), Seq: 616, Ack: 257, Len: 0
[2 Reassembled TCP Segments (615 bytes): #95(615), #96(0)]
Hypertext Transfer Protocol
    HTTP/1.0 200 OK\r\n
    Date: Tue, 20 Mar 2012 02:38:18 GMT\r\n
    Expires: Tue, 20 Mar 2012 02:38:18 GMT\r\n
    Cache-Control: private, max-age=3600\r\n
    Content-Type: text/javascript; charset=UTF-8\r\n
    Content-Disposition: attachment\r\n
    Server: gws\r\n
    X-XSS-Protection: 1; mode=block\r\n
    X-Frame-Options: SAMEORIGIN\r\n
    \r\n
Line-based text data: text/javascript
    [truncated] google.sbox.p0 && google.sbox.p0(["tom",[["tom and jerry",0,"0"],["tom and jerry cartoon",0,"1"],["tomorrowland 2011",0,"2"],["tom and jerry episodes",0,"3"],["tom petty",0,"4"],["tom and jerry movie part 1 out of 10",0,"5"],["

No.     Time        Source                Destination           Protocol Length Info
    103 19.267294   10.0.2.15             173.194.34.6          HTTP     378    GET /complete/search?client=youtube&hl=en&ds=yt&cp=4&gs_id=l&callback=google.sbox.p0&q=jerry HTTP/1.0 

Frame 103: 378 bytes on wire (3024 bits), 378 bytes captured (3024 bits)
Ethernet II, Src: CadmusCo_96:83:18 (08:00:27:96:83:18), Dst: RealtekU_12:35:02 (52:54:00:12:35:02)
Internet Protocol Version 4, Src: 10.0.2.15 (10.0.2.15), Dst: 173.194.34.6 (173.194.34.6)
Transmission Control Protocol, Src Port: nim (1058), Dst Port: http (80), Seq: 1, Ack: 1, Len: 324
Hypertext Transfer Protocol
    GET /complete/search?client=youtube&hl=en&ds=yt&cp=4&gs_id=l&callback=google.sbox.p0&q=jerry HTTP/1.0\r\n
    Accept: image/gif, image/x-xbitmap, image/jpeg, image/pjpeg, */*\r\n
    User-Agent: Mozilla/4.0 (compatible; MSIE 7.0; Windows NT 5.1; .NET CLR 1.1.4322; .NET CLR 2.0.50727; .NET CLR 3.0.04506.30)\r\n
    Host: clients1.google.com\r\n
    \r\n
    [Full request URI: http://clients1.google.com/complete/search?client=youtube&hl=en&ds=yt&cp=4&gs_id=l&callback=google.sbox.p0&q=jerry]

No.     Time        Source                Destination           Protocol Length Info
    106 19.318186   173.194.34.6          10.0.2.15             HTTP     60     HTTP/1.0 200 OK  (text/javascript)

Frame 106: 60 bytes on wire (480 bits), 60 bytes captured (480 bits)
Ethernet II, Src: RealtekU_12:35:02 (52:54:00:12:35:02), Dst: CadmusCo_96:83:18 (08:00:27:96:83:18)
Internet Protocol Version 4, Src: 173.194.34.6 (173.194.34.6), Dst: 10.0.2.15 (10.0.2.15)
Transmission Control Protocol, Src Port: http (80), Dst Port: nim (1058), Seq: 618, Ack: 325, Len: 0
[2 Reassembled TCP Segments (617 bytes): #105(617), #106(0)]
Hypertext Transfer Protocol
    HTTP/1.0 200 OK\r\n
    Date: Tue, 20 Mar 2012 02:38:18 GMT\r\n
    Expires: Tue, 20 Mar 2012 02:38:18 GMT\r\n
    Cache-Control: private, max-age=3600\r\n
    Content-Type: text/javascript; charset=UTF-8\r\n
    Content-Disposition: attachment\r\n
    Server: gws\r\n
    X-XSS-Protection: 1; mode=block\r\n
    X-Frame-Options: SAMEORIGIN\r\n
    \r\n
Line-based text data: text/javascript
    [truncated] google.sbox.p0 && google.sbox.p0(["jerry",[["jerry lavigne jr",0,"0"],["jerry lee lewis",0,"1"],["jerry rivera",0,"2"],["jerry springer show",0,"3"],["jerry springer",0,"4"],["jerry reed",0,"5"],["jerry lee lewis great balls of

No.     Time        Source                Destination           Protocol Length Info
    115 19.568939   10.0.2.15             213.254.248.187       HTTP     294    GET /osjson.aspx?query=tom HTTP/1.0 

Frame 115: 294 bytes on wire (2352 bits), 294 bytes captured (2352 bits)
Ethernet II, Src: CadmusCo_96:83:18 (08:00:27:96:83:18), Dst: RealtekU_12:35:02 (52:54:00:12:35:02)
Internet Protocol Version 4, Src: 10.0.2.15 (10.0.2.15), Dst: 213.254.248.187 (213.254.248.187)
Transmission Control Protocol, Src Port: nimreg (1059), Dst Port: http (80), Seq: 1, Ack: 1, Len: 240
Hypertext Transfer Protocol
    GET /osjson.aspx?query=tom HTTP/1.0\r\n
    Accept: image/gif, image/x-xbitmap, image/jpeg, image/pjpeg, */*\r\n
    User-Agent: Mozilla/5.0 (X11; U; Linux i686; it-IT; rv:1.9.0.2) Gecko/2008092313 Ubuntu/9.25 (jaunty) Firefox/3.8\r\n
    Host: api.bing.com\r\n
    \r\n
    [Full request URI: http://api.bing.com/osjson.aspx?query=tom]

No.     Time        Source                Destination           Protocol Length Info
    117 19.731760   213.254.248.187       10.0.2.15             HTTP     390    HTTP/1.0 200 OK  (application/json)

Frame 117: 390 bytes on wire (3120 bits), 390 bytes captured (3120 bits)
Ethernet II, Src: RealtekU_12:35:02 (52:54:00:12:35:02), Dst: CadmusCo_96:83:18 (08:00:27:96:83:18)
Internet Protocol Version 4, Src: 213.254.248.187 (213.254.248.187), Dst: 10.0.2.15 (10.0.2.15)
Transmission Control Protocol, Src Port: http (80), Dst Port: nimreg (1059), Seq: 1, Ack: 241, Len: 336
Hypertext Transfer Protocol
    HTTP/1.0 200 OK\r\n
    Content-Length: 130\r\n
        [Content length: 130]
    Content-Type: application/json; charset=utf-8\r\n
    X-Content-Type-Options: nosniff\r\n
    Cache-Control: max-age=86400\r\n
    Date: Tue, 20 Mar 2012 02:38:19 GMT\r\n
    Connection: close\r\n
    \r\n
JavaScript Object Notation: application/json

No.     Time        Source                Destination           Protocol Length Info
    125 19.971621   10.0.2.15             213.254.248.187       HTTP     308    GET /osjson.aspx?query=jerry HTTP/1.0 

Frame 125: 308 bytes on wire (2464 bits), 308 bytes captured (2464 bits)
Ethernet II, Src: CadmusCo_96:83:18 (08:00:27:96:83:18), Dst: RealtekU_12:35:02 (52:54:00:12:35:02)
Internet Protocol Version 4, Src: 10.0.2.15 (10.0.2.15), Dst: 213.254.248.187 (213.254.248.187)
Transmission Control Protocol, Src Port: polestar (1060), Dst Port: http (80), Seq: 1, Ack: 1, Len: 254
Hypertext Transfer Protocol
    GET /osjson.aspx?query=jerry HTTP/1.0\r\n
    Accept: image/gif, image/x-xbitmap, image/jpeg, image/pjpeg, */*\r\n
    User-Agent: Mozilla/5.0 (Windows; U; Windows NT 5.1; en-US; rv:1.9.0.14) Gecko/2009082707 Firefox/3.0.14 (.NET CLR 3.5.30729)\r\n
    Host: api.bing.com\r\n
    \r\n
    [Full request URI: http://api.bing.com/osjson.aspx?query=jerry]

No.     Time        Source                Destination           Protocol Length Info
    127 20.136686   213.254.248.187       10.0.2.15             HTTP     401    HTTP/1.0 200 OK  (application/json)

Frame 127: 401 bytes on wire (3208 bits), 401 bytes captured (3208 bits)
Ethernet II, Src: RealtekU_12:35:02 (52:54:00:12:35:02), Dst: CadmusCo_96:83:18 (08:00:27:96:83:18)
Internet Protocol Version 4, Src: 213.254.248.187 (213.254.248.187), Dst: 10.0.2.15 (10.0.2.15)
Transmission Control Protocol, Src Port: http (80), Dst Port: polestar (1060), Seq: 1, Ack: 255, Len: 347
Hypertext Transfer Protocol
    HTTP/1.0 200 OK\r\n
    Content-Length: 141\r\n
        [Content length: 141]
    Content-Type: application/json; charset=utf-8\r\n
    X-Content-Type-Options: nosniff\r\n
    Cache-Control: max-age=86400\r\n
    Date: Tue, 20 Mar 2012 02:38:19 GMT\r\n
    Connection: close\r\n
    \r\n
JavaScript Object Notation: application/json

No.     Time        Source                Destination           Protocol Length Info
    135 20.298585   10.0.2.15             173.194.34.6          HTTP     383    GET /complete/search?hl=en&gl=us&ds=pr&client=products&hjson=t&jsonp=ac_hr&q=tom&cp=10 HTTP/1.0 

Frame 135: 383 bytes on wire (3064 bits), 383 bytes captured (3064 bits)
Ethernet II, Src: CadmusCo_96:83:18 (08:00:27:96:83:18), Dst: RealtekU_12:35:02 (52:54:00:12:35:02)
Internet Protocol Version 4, Src: 10.0.2.15 (10.0.2.15), Dst: 173.194.34.6 (173.194.34.6)
Transmission Control Protocol, Src Port: kiosk (1061), Dst Port: http (80), Seq: 1, Ack: 1, Len: 329
Hypertext Transfer Protocol
    GET /complete/search?hl=en&gl=us&ds=pr&client=products&hjson=t&jsonp=ac_hr&q=tom&cp=10 HTTP/1.0\r\n
    Accept: image/gif, image/x-xbitmap, image/jpeg, image/pjpeg, */*\r\n
    User-Agent: Mozilla/4.0 (compatible; MSIE 8.0; Windows NT 6.1; WOW64; Trident/4.0; SLCC2; Media Center PC 6.0; InfoPath.2; MS-RTC LM 8)\r\n
    Host: clients1.google.com\r\n
    \r\n
    [Full request URI: http://clients1.google.com/complete/search?hl=en&gl=us&ds=pr&client=products&hjson=t&jsonp=ac_hr&q=tom&cp=10]

No.     Time        Source                Destination           Protocol Length Info
    138 20.348770   173.194.34.6          10.0.2.15             HTTP     60     HTTP/1.0 200 OK  (text/javascript)

Frame 138: 60 bytes on wire (480 bits), 60 bytes captured (480 bits)
Ethernet II, Src: RealtekU_12:35:02 (52:54:00:12:35:02), Dst: CadmusCo_96:83:18 (08:00:27:96:83:18)
Internet Protocol Version 4, Src: 173.194.34.6 (173.194.34.6), Dst: 10.0.2.15 (10.0.2.15)
Transmission Control Protocol, Src Port: http (80), Dst Port: kiosk (1061), Seq: 539, Ack: 330, Len: 0
[2 Reassembled TCP Segments (538 bytes): #137(538), #138(0)]
Hypertext Transfer Protocol
    HTTP/1.0 200 OK\r\n
    Date: Tue, 20 Mar 2012 02:38:19 GMT\r\n
    Expires: Tue, 20 Mar 2012 02:38:19 GMT\r\n
    Cache-Control: private, max-age=3600\r\n
    Content-Type: text/javascript; charset=UTF-8\r\n
    Content-Disposition: attachment\r\n
    Server: gws\r\n
    X-XSS-Protection: 1; mode=block\r\n
    X-Frame-Options: SAMEORIGIN\r\n
    \r\n
Line-based text data: text/javascript
    [truncated] ac_hr(["tom",[["toms","","0"],["toms shoes","","1"],["tomahawk","","2"],["tomtom","","3"],["tomtom gps","","4"],["tomtom xxl 530s","","5"],["tommy hilfiger","","6"],["tomtom xxl 540tm","","7"],["tomtom xxl","","8"],["tom and je

No.     Time        Source                Destination           Protocol Length Info
    145 20.519330   10.0.2.15             173.194.34.6          HTTP     363    GET /complete/search?hl=en&gl=us&ds=pr&client=products&hjson=t&jsonp=ac_hr&q=jerry&cp=10 HTTP/1.0 

Frame 145: 363 bytes on wire (2904 bits), 363 bytes captured (2904 bits)
Ethernet II, Src: CadmusCo_96:83:18 (08:00:27:96:83:18), Dst: RealtekU_12:35:02 (52:54:00:12:35:02)
Internet Protocol Version 4, Src: 10.0.2.15 (10.0.2.15), Dst: 173.194.34.6 (173.194.34.6)
Transmission Control Protocol, Src Port: veracity (1062), Dst Port: http (80), Seq: 1, Ack: 1, Len: 309
Hypertext Transfer Protocol
    GET /complete/search?hl=en&gl=us&ds=pr&client=products&hjson=t&jsonp=ac_hr&q=jerry&cp=10 HTTP/1.0\r\n
    Accept: image/gif, image/x-xbitmap, image/jpeg, image/pjpeg, */*\r\n
    User-Agent: Mozilla/5.0 (X11; U; Linux i686; it-IT; rv:1.9.0.2) Gecko/2008092313 Ubuntu/9.25 (jaunty) Firefox/3.8\r\n
    Host: clients1.google.com\r\n
    \r\n
    [Full request URI: http://clients1.google.com/complete/search?hl=en&gl=us&ds=pr&client=products&hjson=t&jsonp=ac_hr&q=jerry&cp=10]

No.     Time        Source                Destination           Protocol Length Info
    148 20.571483   173.194.34.6          10.0.2.15             HTTP     60     HTTP/1.0 200 OK  (text/javascript)

Frame 148: 60 bytes on wire (480 bits), 60 bytes captured (480 bits)
Ethernet II, Src: RealtekU_12:35:02 (52:54:00:12:35:02), Dst: CadmusCo_96:83:18 (08:00:27:96:83:18)
Internet Protocol Version 4, Src: 173.194.34.6 (173.194.34.6), Dst: 10.0.2.15 (10.0.2.15)
Transmission Control Protocol, Src Port: http (80), Dst Port: veracity (1062), Seq: 585, Ack: 310, Len: 0
[2 Reassembled TCP Segments (584 bytes): #147(584), #148(0)]
Hypertext Transfer Protocol
    HTTP/1.0 200 OK\r\n
    Date: Tue, 20 Mar 2012 02:38:19 GMT\r\n
    Expires: Tue, 20 Mar 2012 02:38:19 GMT\r\n
    Cache-Control: private, max-age=3600\r\n
    Content-Type: text/javascript; charset=UTF-8\r\n
    Content-Disposition: attachment\r\n
    Server: gws\r\n
    X-XSS-Protection: 1; mode=block\r\n
    X-Frame-Options: SAMEORIGIN\r\n
    \r\n
Line-based text data: text/javascript
    [truncated] ac_hr(["jerry",[["jerry can","","0"],["jerry can holder","","1"],["jerry rice rookie card","","2"],["jerry garcia ties","","3"],["jerry rice jersey","","4"],["jerry can mount","","5"],["jerry clower","","6"],["jerry can spout",

No.     Time        Source                Destination           Protocol Length Info
    157 21.119751   10.0.2.15             74.120.180.22         HTTP     248    GET /ajaxSearchAssistant?q=tom HTTP/1.0 

Frame 157: 248 bytes on wire (1984 bits), 248 bytes captured (1984 bits)
Ethernet II, Src: CadmusCo_96:83:18 (08:00:27:96:83:18), Dst: RealtekU_12:35:02 (52:54:00:12:35:02)
Internet Protocol Version 4, Src: 10.0.2.15 (10.0.2.15), Dst: 74.120.180.22 (74.120.180.22)
Transmission Control Protocol, Src Port: kyoceranetdev (1063), Dst Port: http (80), Seq: 1, Ack: 1, Len: 194
Hypertext Transfer Protocol
    GET /ajaxSearchAssistant?q=tom HTTP/1.0\r\n
    Accept: image/gif, image/x-xbitmap, image/jpeg, image/pjpeg, */*\r\n
    User-Agent: Opera/9.64(Windows NT 5.1; U; en) Presto/2.1.1\r\n
    Host: www4.shopping.com\r\n
    \r\n
    [Full request URI: http://www4.shopping.com/ajaxSearchAssistant?q=tom]

No.     Time        Source                Destination           Protocol Length Info
    159 21.302751   74.120.180.22         10.0.2.15             HTTP     251    HTTP/1.1 301 Moved Permanently 

Frame 159: 251 bytes on wire (2008 bits), 251 bytes captured (2008 bits)
Ethernet II, Src: RealtekU_12:35:02 (52:54:00:12:35:02), Dst: CadmusCo_96:83:18 (08:00:27:96:83:18)
Internet Protocol Version 4, Src: 74.120.180.22 (74.120.180.22), Dst: 10.0.2.15 (10.0.2.15)
Transmission Control Protocol, Src Port: http (80), Dst Port: kyoceranetdev (1063), Seq: 1, Ack: 195, Len: 197
Hypertext Transfer Protocol
    HTTP/1.1 301 Moved Permanently\r\n
    Server: Apache-Coyote/1.1\r\n
    Location: http://www.shopping.com/ajaxSearchAssistant?q=tom\r\n
    Content-Length: 0\r\n
        [Content length: 0]
    Date: Tue, 20 Mar 2012 02:38:20 GMT\r\n
    Connection: close\r\n
    \r\n

No.     Time        Source                Destination           Protocol Length Info
    169 21.510231   10.0.2.15             74.120.180.22         HTTP     247    GET /ajaxSearchAssistant?q=tom HTTP/1.0 

Frame 169: 247 bytes on wire (1976 bits), 247 bytes captured (1976 bits)
Ethernet II, Src: CadmusCo_96:83:18 (08:00:27:96:83:18), Dst: RealtekU_12:35:02 (52:54:00:12:35:02)
Internet Protocol Version 4, Src: 10.0.2.15 (10.0.2.15), Dst: 74.120.180.22 (74.120.180.22)
Transmission Control Protocol, Src Port: jstel (1064), Dst Port: http (80), Seq: 1, Ack: 1, Len: 193
Hypertext Transfer Protocol
    GET /ajaxSearchAssistant?q=tom HTTP/1.0\r\n
    Accept: image/gif, image/x-xbitmap, image/jpeg, image/pjpeg, */*\r\n
    User-Agent: Opera/9.64(Windows NT 5.1; U; en) Presto/2.1.1\r\n
    Host: www.shopping.com\r\n
    \r\n
    [Full request URI: http://www.shopping.com/ajaxSearchAssistant?q=tom]

No.     Time        Source                Destination           Protocol Length Info
    171 21.697507   74.120.180.22         10.0.2.15             HTTP/XML 1012   HTTP/1.1 200 OK 

Frame 171: 1012 bytes on wire (8096 bits), 1012 bytes captured (8096 bits)
Ethernet II, Src: RealtekU_12:35:02 (52:54:00:12:35:02), Dst: CadmusCo_96:83:18 (08:00:27:96:83:18)
Internet Protocol Version 4, Src: 74.120.180.22 (74.120.180.22), Dst: 10.0.2.15 (10.0.2.15)
Transmission Control Protocol, Src Port: http (80), Dst Port: jstel (1064), Seq: 1, Ack: 194, Len: 958
Hypertext Transfer Protocol
    HTTP/1.1 200 OK\r\n
    Server: Apache-Coyote/1.1\r\n
    Set-Cookie: btc=www.shopping.com; Domain=shopping.com; Expires=Wed, 21-Mar-2012 02:38:21 GMT; Path=/\r\n
    Set-Cookie: JSESSIONID=D9898015F31479893C386AD170EF29C0; Path=/\r\n
    Set-Cookie: session=ts%3D2; Domain=.shopping.com; Path=/\r\n
    Set-Cookie: reloadCheck=%2FajaxSearchAssistant%3Fq%3Dtomnull; Domain=.shopping.com; Path=/\r\n
    Set-Cookie: DealTimeUserID=wXS51CpGCZ; Domain=.shopping.com; Expires=Sun, 20-Mar-2022 02:38:21 GMT; Path=/\r\n
    Content-Type: text/xml;charset=UTF-8\r\n
    Content-Length: 372\r\n
        [Content length: 372]
    Date: Tue, 20 Mar 2012 02:38:20 GMT\r\n
    Connection: close\r\n
    \r\n
eXtensible Markup Language
    <?xml
    <response>

No.     Time        Source                Destination           Protocol Length Info
    179 22.011046   10.0.2.15             74.120.180.22         HTTP     327    GET /ajaxSearchAssistant?q=jerry HTTP/1.0 

Frame 179: 327 bytes on wire (2616 bits), 327 bytes captured (2616 bits)
Ethernet II, Src: CadmusCo_96:83:18 (08:00:27:96:83:18), Dst: RealtekU_12:35:02 (52:54:00:12:35:02)
Internet Protocol Version 4, Src: 10.0.2.15 (10.0.2.15), Dst: 74.120.180.22 (74.120.180.22)
Transmission Control Protocol, Src Port: syscomlan (1065), Dst Port: http (80), Seq: 1, Ack: 1, Len: 273
Hypertext Transfer Protocol
    GET /ajaxSearchAssistant?q=jerry HTTP/1.0\r\n
    Accept: image/gif, image/x-xbitmap, image/jpeg, image/pjpeg, */*\r\n
    User-Agent: Mozilla/4.0 (compatible; MSIE 8.0; Windows NT 6.1; WOW64; Trident/4.0; SLCC2; Media Center PC 6.0; InfoPath.2; MS-RTC LM 8)\r\n
    Host: www4.shopping.com\r\n
    \r\n
    [Full request URI: http://www4.shopping.com/ajaxSearchAssistant?q=jerry]

No.     Time        Source                Destination           Protocol Length Info
    181 22.196141   74.120.180.22         10.0.2.15             HTTP     253    HTTP/1.1 301 Moved Permanently 

Frame 181: 253 bytes on wire (2024 bits), 253 bytes captured (2024 bits)
Ethernet II, Src: RealtekU_12:35:02 (52:54:00:12:35:02), Dst: CadmusCo_96:83:18 (08:00:27:96:83:18)
Internet Protocol Version 4, Src: 74.120.180.22 (74.120.180.22), Dst: 10.0.2.15 (10.0.2.15)
Transmission Control Protocol, Src Port: http (80), Dst Port: syscomlan (1065), Seq: 1, Ack: 274, Len: 199
Hypertext Transfer Protocol
    HTTP/1.1 301 Moved Permanently\r\n
    Server: Apache-Coyote/1.1\r\n
    Location: http://www.shopping.com/ajaxSearchAssistant?q=jerry\r\n
    Content-Length: 0\r\n
        [Content length: 0]
    Date: Tue, 20 Mar 2012 02:38:20 GMT\r\n
    Connection: close\r\n
    \r\n

No.     Time        Source                Destination           Protocol Length Info
    189 22.391580   10.0.2.15             74.120.180.22         HTTP     326    GET /ajaxSearchAssistant?q=jerry HTTP/1.0 

Frame 189: 326 bytes on wire (2608 bits), 326 bytes captured (2608 bits)
Ethernet II, Src: CadmusCo_96:83:18 (08:00:27:96:83:18), Dst: RealtekU_12:35:02 (52:54:00:12:35:02)
Internet Protocol Version 4, Src: 10.0.2.15 (10.0.2.15), Dst: 74.120.180.22 (74.120.180.22)
Transmission Control Protocol, Src Port: fpo-fns (1066), Dst Port: http (80), Seq: 1, Ack: 1, Len: 272
Hypertext Transfer Protocol
    GET /ajaxSearchAssistant?q=jerry HTTP/1.0\r\n
    Accept: image/gif, image/x-xbitmap, image/jpeg, image/pjpeg, */*\r\n
    User-Agent: Mozilla/4.0 (compatible; MSIE 8.0; Windows NT 6.1; WOW64; Trident/4.0; SLCC2; Media Center PC 6.0; InfoPath.2; MS-RTC LM 8)\r\n
    Host: www.shopping.com\r\n
    \r\n
    [Full request URI: http://www.shopping.com/ajaxSearchAssistant?q=jerry]

No.     Time        Source                Destination           Protocol Length Info
    191 22.577496   74.120.180.22         10.0.2.15             HTTP/XML 1060   HTTP/1.1 200 OK 

Frame 191: 1060 bytes on wire (8480 bits), 1060 bytes captured (8480 bits)
Ethernet II, Src: RealtekU_12:35:02 (52:54:00:12:35:02), Dst: CadmusCo_96:83:18 (08:00:27:96:83:18)
Internet Protocol Version 4, Src: 74.120.180.22 (74.120.180.22), Dst: 10.0.2.15 (10.0.2.15)
Transmission Control Protocol, Src Port: http (80), Dst Port: fpo-fns (1066), Seq: 1, Ack: 273, Len: 1006
Hypertext Transfer Protocol
    HTTP/1.1 200 OK\r\n
    Server: Apache-Coyote/1.1\r\n
    Set-Cookie: btc=www.shopping.com; Domain=shopping.com; Expires=Wed, 21-Mar-2012 02:38:21 GMT; Path=/\r\n
    Set-Cookie: JSESSIONID=8450C5F327A4C6BE1B6E5833BB8520EB; Path=/\r\n
    Set-Cookie: session=ts%3D2; Domain=.shopping.com; Path=/\r\n
    Set-Cookie: reloadCheck=%2FajaxSearchAssistant%3Fq%3Djerrynull; Domain=.shopping.com; Path=/\r\n
    Set-Cookie: DealTimeUserID=Jd3WTuhrQ8; Domain=.shopping.com; Expires=Sun, 20-Mar-2022 02:38:21 GMT; Path=/\r\n
    Content-Type: text/xml;charset=UTF-8\r\n
    Content-Length: 418\r\n
        [Content length: 418]
    Date: Tue, 20 Mar 2012 02:38:21 GMT\r\n
    Connection: close\r\n
    \r\n
eXtensible Markup Language
    <?xml
    <response>

No.     Time        Source                Destination           Protocol Length Info
    199 22.872958   10.0.2.15             216.109.126.242       HTTP     343    GET /gossip-us-sayt/?output=yjsonp&nresults=5&l=1&command=tom HTTP/1.0 

Frame 199: 343 bytes on wire (2744 bits), 343 bytes captured (2744 bits)
Ethernet II, Src: CadmusCo_96:83:18 (08:00:27:96:83:18), Dst: RealtekU_12:35:02 (52:54:00:12:35:02)
Internet Protocol Version 4, Src: 10.0.2.15 (10.0.2.15), Dst: 216.109.126.242 (216.109.126.242)
Transmission Control Protocol, Src Port: instl-boots (1067), Dst Port: http (80), Seq: 1, Ack: 1, Len: 289
Hypertext Transfer Protocol
    GET /gossip-us-sayt/?output=yjsonp&nresults=5&l=1&command=tom HTTP/1.0\r\n
    Accept: image/gif, image/x-xbitmap, image/jpeg, image/pjpeg, */*\r\n
    User-Agent: Mozilla/5.0 (Windows; U; Windows NT 5.1; de; rv:1.9.1.3) Gecko/20090824 Firefox/3.5.3 (.NET CLR 3.5.30729)\r\n
    Host: sugg.search.yahoo.com\r\n
    \r\n
    [Full request URI: http://sugg.search.yahoo.com/gossip-us-sayt/?output=yjsonp&nresults=5&l=1&command=tom]

No.     Time        Source                Destination           Protocol Length Info
    201 23.007878   216.109.126.242       10.0.2.15             HTTP     777    HTTP/1.0 200 OK  (application/javascript)

Frame 201: 777 bytes on wire (6216 bits), 777 bytes captured (6216 bits)
Ethernet II, Src: RealtekU_12:35:02 (52:54:00:12:35:02), Dst: CadmusCo_96:83:18 (08:00:27:96:83:18)
Internet Protocol Version 4, Src: 216.109.126.242 (216.109.126.242), Dst: 10.0.2.15 (10.0.2.15)
Transmission Control Protocol, Src Port: http (80), Dst Port: instl-boots (1067), Seq: 1, Ack: 290, Len: 723
Hypertext Transfer Protocol
    HTTP/1.0 200 OK\r\n
    Date: Tue, 20 Mar 2012 02:38:22 GMT\r\n
    Set-Cookie: B=dvqe9bp7mfrcu&b=3&s=vo; expires=Tue, 21-Mar-2014 20:00:00 GMT; path=/; domain=.yahoo.com\r\n
    P3P: policyref="http://info.yahoo.com/w3c/p3p.xml", CP="CAO DSP COR CUR ADM DEV TAI PSA PSD IVAi IVDi CONi TELo OTPi OUR DELi SAMi OTRi UNRi PUBi IND PHY ONL UNI PUR FIN COM NAV INT DEM CNT STA POL HEA PRE LOC GOV"\r\n
    Content-Length: 157\r\n
        [Content length: 157]
    Expires: Tue, 20 Mar 2012 03:38:22 GMT\r\n
    Vary: Accept-Encoding\r\n
    Content-Type: application/javascript; charset=UTF-8\r\n
    Cache-Control: private\r\n
    Age: 0\r\n
    Server: YTS/1.19.11\r\n
    \r\n
Media Type

No.     Time        Source                Destination           Protocol Length Info
    209 23.255556   10.0.2.15             216.109.126.242       HTTP     362    GET /gossip-us-sayt/?output=yjsonp&nresults=5&l=1&command=jerry HTTP/1.0 

Frame 209: 362 bytes on wire (2896 bits), 362 bytes captured (2896 bits)
Ethernet II, Src: CadmusCo_96:83:18 (08:00:27:96:83:18), Dst: RealtekU_12:35:02 (52:54:00:12:35:02)
Internet Protocol Version 4, Src: 10.0.2.15 (10.0.2.15), Dst: 216.109.126.242 (216.109.126.242)
Transmission Control Protocol, Src Port: instl-bootc (1068), Dst Port: http (80), Seq: 1, Ack: 1, Len: 308
Hypertext Transfer Protocol
    GET /gossip-us-sayt/?output=yjsonp&nresults=5&l=1&command=jerry HTTP/1.0\r\n
    Accept: image/gif, image/x-xbitmap, image/jpeg, image/pjpeg, */*\r\n
    User-Agent: Mozilla/4.0 (compatible; MSIE 8.0; Windows NT 6.1; WOW64; Trident/4.0; SLCC2; Media Center PC 6.0; InfoPath.2; MS-RTC LM 8)\r\n
    Host: sugg.search.yahoo.com\r\n
    \r\n
    [Full request URI: http://sugg.search.yahoo.com/gossip-us-sayt/?output=yjsonp&nresults=5&l=1&command=jerry]

No.     Time        Source                Destination           Protocol Length Info
    211 23.392115   216.109.126.242       10.0.2.15             HTTP     797    HTTP/1.0 200 OK  (application/javascript)

Frame 211: 797 bytes on wire (6376 bits), 797 bytes captured (6376 bits)
Ethernet II, Src: RealtekU_12:35:02 (52:54:00:12:35:02), Dst: CadmusCo_96:83:18 (08:00:27:96:83:18)
Internet Protocol Version 4, Src: 216.109.126.242 (216.109.126.242), Dst: 10.0.2.15 (10.0.2.15)
Transmission Control Protocol, Src Port: http (80), Dst Port: instl-bootc (1068), Seq: 1, Ack: 309, Len: 743
Hypertext Transfer Protocol
    HTTP/1.0 200 OK\r\n
    Date: Tue, 20 Mar 2012 02:38:22 GMT\r\n
    Set-Cookie: B=6e0b0l17mfrcu&b=3&s=k9; expires=Tue, 21-Mar-2014 20:00:00 GMT; path=/; domain=.yahoo.com\r\n
    P3P: policyref="http://info.yahoo.com/w3c/p3p.xml", CP="CAO DSP COR CUR ADM DEV TAI PSA PSD IVAi IVDi CONi TELo OTPi OUR DELi SAMi OTRi UNRi PUBi IND PHY ONL UNI PUR FIN COM NAV INT DEM CNT STA POL HEA PRE LOC GOV"\r\n
    Content-Length: 177\r\n
        [Content length: 177]
    Expires: Tue, 20 Mar 2012 03:38:22 GMT\r\n
    Vary: Accept-Encoding\r\n
    Content-Type: application/javascript; charset=UTF-8\r\n
    Cache-Control: private\r\n
    Age: 0\r\n
    Server: YTS/1.19.11\r\n
    \r\n
Media Type

No.     Time        Source                Destination           Protocol Length Info
    221 23.853679   10.0.2.15             66.235.120.111        HTTP     326    GET /query?fn=suggestCallBack&q=tom&sstype=prefix&noCacheIE=1264502793526 HTTP/1.0 

Frame 221: 326 bytes on wire (2608 bits), 326 bytes captured (2608 bits)
Ethernet II, Src: CadmusCo_96:83:18 (08:00:27:96:83:18), Dst: RealtekU_12:35:02 (52:54:00:12:35:02)
Internet Protocol Version 4, Src: 10.0.2.15 (10.0.2.15), Dst: 66.235.120.111 (66.235.120.111)
Transmission Control Protocol, Src Port: cognex-insight (1069), Dst Port: http (80), Seq: 1, Ack: 1, Len: 272
Hypertext Transfer Protocol
    GET /query?fn=suggestCallBack&q=tom&sstype=prefix&noCacheIE=1264502793526 HTTP/1.0\r\n
    Accept: image/gif, image/x-xbitmap, image/jpeg, image/pjpeg, */*\r\n
    User-Agent: Mozilla/5.0 (Windows; U; Windows NT 6.1; en-GB; rv:1.9.1.3) Gecko/20090824 Firefox/3.5.3\r\n
    Host: ss.ask.com\r\n
    \r\n
    [Full request URI: http://ss.ask.com/query?fn=suggestCallBack&q=tom&sstype=prefix&noCacheIE=1264502793526]

No.     Time        Source                Destination           Protocol Length Info
    223 23.971234   66.235.120.111        10.0.2.15             HTTP     748    HTTP/1.1 200 OK  (text/javascript)

Frame 223: 748 bytes on wire (5984 bits), 748 bytes captured (5984 bits)
Ethernet II, Src: RealtekU_12:35:02 (52:54:00:12:35:02), Dst: CadmusCo_96:83:18 (08:00:27:96:83:18)
Internet Protocol Version 4, Src: 66.235.120.111 (66.235.120.111), Dst: 10.0.2.15 (10.0.2.15)
Transmission Control Protocol, Src Port: http (80), Dst Port: cognex-insight (1069), Seq: 1, Ack: 273, Len: 694
Hypertext Transfer Protocol
    HTTP/1.1 200 OK\r\n
    Date: Tue, 20 Mar 2012 02:38:23 GMT\r\n
    Server: Apache/2.2.13 (Unix)\r\n
    Content-Length: 537\r\n
        [Content length: 537]
    Connection: close\r\n
    Content-Type: text/javascript\r\n
    \r\n
Line-based text data: text/javascript
    suggestCallBack(["tom",\r\n
    [truncated] ["<span class=\\\"suggest\\\">tom</span> condon","<span class=\\\"suggest\\\">tom</span>orrow","<span class=\\\"suggest\\\">tom</span> smitty smith","<span class=\\\"suggest\\\">tom</span>s shoes","<span class=\\\"suggest\\\">t

No.     Time        Source                Destination           Protocol Length Info
    231 24.210055   10.0.2.15             66.235.120.111        HTTP     286    GET /query?fn=suggestCallBack&q=jerry&sstype=prefix&noCacheIE=1264502793526 HTTP/1.0 

Frame 231: 286 bytes on wire (2288 bits), 286 bytes captured (2288 bits)
Ethernet II, Src: CadmusCo_96:83:18 (08:00:27:96:83:18), Dst: RealtekU_12:35:02 (52:54:00:12:35:02)
Internet Protocol Version 4, Src: 10.0.2.15 (10.0.2.15), Dst: 66.235.120.111 (66.235.120.111)
Transmission Control Protocol, Src Port: gmrupdateserv (1070), Dst Port: http (80), Seq: 1, Ack: 1, Len: 232
Hypertext Transfer Protocol
    GET /query?fn=suggestCallBack&q=jerry&sstype=prefix&noCacheIE=1264502793526 HTTP/1.0\r\n
    Accept: image/gif, image/x-xbitmap, image/jpeg, image/pjpeg, */*\r\n
    User-Agent: Opera/9.64(Windows NT 5.1; U; en) Presto/2.1.1\r\n
    Host: ss.ask.com\r\n
    \r\n
    [Full request URI: http://ss.ask.com/query?fn=suggestCallBack&q=jerry&sstype=prefix&noCacheIE=1264502793526]

No.     Time        Source                Destination           Protocol Length Info
    233 24.326530   66.235.120.111        10.0.2.15             HTTP     805    HTTP/1.1 200 OK  (text/javascript)

Frame 233: 805 bytes on wire (6440 bits), 805 bytes captured (6440 bits)
Ethernet II, Src: RealtekU_12:35:02 (52:54:00:12:35:02), Dst: CadmusCo_96:83:18 (08:00:27:96:83:18)
Internet Protocol Version 4, Src: 66.235.120.111 (66.235.120.111), Dst: 10.0.2.15 (10.0.2.15)
Transmission Control Protocol, Src Port: http (80), Dst Port: gmrupdateserv (1070), Seq: 1, Ack: 233, Len: 751
Hypertext Transfer Protocol
    HTTP/1.1 200 OK\r\n
    Date: Tue, 20 Mar 2012 02:38:23 GMT\r\n
    Server: Apache/2.2.13 (Unix)\r\n
    Content-Length: 594\r\n
        [Content length: 594]
    Connection: close\r\n
    Content-Type: text/javascript\r\n
    \r\n
Line-based text data: text/javascript
    suggestCallBack(["jerry",\r\n
    [truncated] ["<span class=\\\"suggest\\\">jerry</span> lewis","<span class=\\\"suggest\\\">jerry</span> fountain","<span class=\\\"suggest\\\">jerry</span> brown","<span class=\\\"suggest\\\">jerry</span> springer episodes","<span class=\\
