No.     Time        Source                Destination           Protocol Length Info
      7 0.087148    10.0.2.15             173.194.34.49         HTTP     512    GET /search?complete=0&filter=0&output=ie&hl=en&q="Leave+a+Reply"+"Name+(required)"+"Mail+(will+not+be+published)"+"Website"+-site:wordpress.com+"Top+Commenter"+OR+"Top+Commenters"+pokemon&num=100&start=0&as_qdr=all HTTP/1.0 

Frame 7: 512 bytes on wire (4096 bits), 512 bytes captured (4096 bits)
Ethernet II, Src: CadmusCo_96:83:18 (08:00:27:96:83:18), Dst: RealtekU_12:35:02 (52:54:00:12:35:02)
Internet Protocol Version 4, Src: 10.0.2.15 (10.0.2.15), Dst: 173.194.34.49 (173.194.34.49)
Transmission Control Protocol, Src Port: neod1 (1047), Dst Port: http (80), Seq: 1, Ack: 1, Len: 458
Hypertext Transfer Protocol

No.     Time        Source                Destination           Protocol Length Info
    220 0.639436    10.0.2.15             74.6.238.254          HTTP     383    GET /search?n=100&pstart=1&p="Leave+a+Reply"+"Name+(required)"+"Mail+(will+not+be+published)"+"Website"+-site:wordpress.com+"Top+Commenter"+OR+"Top+Commenters"+pokemon&b=1 HTTP/1.0 

Frame 220: 383 bytes on wire (3064 bits), 383 bytes captured (3064 bits)
Ethernet II, Src: CadmusCo_96:83:18 (08:00:27:96:83:18), Dst: RealtekU_12:35:02 (52:54:00:12:35:02)
Internet Protocol Version 4, Src: 10.0.2.15 (10.0.2.15), Dst: 74.6.238.254 (74.6.238.254)
Transmission Control Protocol, Src Port: neod2 (1048), Dst Port: http (80), Seq: 1, Ack: 1, Len: 329
Hypertext Transfer Protocol

No.     Time        Source                Destination           Protocol Length Info
    301 0.710698    173.194.34.49         10.0.2.15             HTTP     60     HTTP/1.0 200 OK  (text/html)

Frame 301: 60 bytes on wire (480 bits), 60 bytes captured (480 bits)
Ethernet II, Src: RealtekU_12:35:02 (52:54:00:12:35:02), Dst: CadmusCo_96:83:18 (08:00:27:96:83:18)
Internet Protocol Version 4, Src: 173.194.34.49 (173.194.34.49), Dst: 10.0.2.15 (10.0.2.15)
Transmission Control Protocol, Src Port: http (80), Dst Port: neod1 (1047), Seq: 256554, Ack: 459, Len: 0
[185 Reassembled TCP Segments (256553 bytes): #9(1418), #10(1418), #12(1418), #13(573), #15(1418), #16(1418), #18(1260), #19(1418), #21(1418), #22(1418), #24(1418), #25(1418), #27(1418), #28(1418), #30(1418), #31(1418), #33(1418), #34(1418)]
Hypertext Transfer Protocol
Line-based text data: text/html

No.     Time        Source                Destination           Protocol Length Info
    675 2.968130    74.6.238.254          10.0.2.15             HTTP     60     HTTP/1.1 200 OK  (text/html)

Frame 675: 60 bytes on wire (480 bits), 60 bytes captured (480 bits)
Ethernet II, Src: RealtekU_12:35:02 (52:54:00:12:35:02), Dst: CadmusCo_96:83:18 (08:00:27:96:83:18)
Internet Protocol Version 4, Src: 74.6.238.254 (74.6.238.254), Dst: 10.0.2.15 (10.0.2.15)
Transmission Control Protocol, Src Port: http (80), Dst Port: neod2 (1048), Seq: 174856, Ack: 330, Len: 0
[243 Reassembled TCP Segments (174855 bytes): #305(1420), #306(20), #308(1420), #309(20), #311(1420), #312(20), #314(1420), #315(20), #317(1420), #318(20), #320(1420), #321(20), #323(701), #325(1420), #326(20), #328(1420), #329(20), #331(14]
Hypertext Transfer Protocol
Line-based text data: text/html
