No.     Time        Source                Destination           Protocol Length Info
      8 0.129386    10.0.2.15             173.194.34.38         HTTP     301    GET /complete/search?output=toolbar&hl=en&q=john HTTP/1.0 

Frame 8: 301 bytes on wire (2408 bits), 301 bytes captured (2408 bits)
Ethernet II, Src: CadmusCo_96:83:18 (08:00:27:96:83:18), Dst: RealtekU_12:35:02 (52:54:00:12:35:02)
Internet Protocol Version 4, Src: 10.0.2.15 (10.0.2.15), Dst: 173.194.34.38 (173.194.34.38)
Transmission Control Protocol, Src Port: casp (1130), Dst Port: http (80), Seq: 1, Ack: 1, Len: 247
Hypertext Transfer Protocol
    GET /complete/search?output=toolbar&hl=en&q=john HTTP/1.0\r\n
    Accept: image/gif, image/x-xbitmap, image/jpeg, image/pjpeg, */*\r\n
    User-Agent: Mozilla/5.0 (Windows; U; Windows NT 6.1; en-GB; rv:1.9.1.3) Gecko/20090824 Firefox/3.5.3\r\n
    Host: google.com\r\n
    \r\n
    [Full request URI: http://google.com/complete/search?output=toolbar&hl=en&q=john]

No.     Time        Source                Destination           Protocol Length Info
     13 0.190802    173.194.34.38         10.0.2.15             HTTP/XML 60     HTTP/1.0 200 OK 

Frame 13: 60 bytes on wire (480 bits), 60 bytes captured (480 bits)
Ethernet II, Src: RealtekU_12:35:02 (52:54:00:12:35:02), Dst: CadmusCo_96:83:18 (08:00:27:96:83:18)
Internet Protocol Version 4, Src: 173.194.34.38 (173.194.34.38), Dst: 10.0.2.15 (10.0.2.15)
Transmission Control Protocol, Src Port: http (80), Dst Port: casp (1130), Seq: 1467, Ack: 248, Len: 0
[3 Reassembled TCP Segments (1466 bytes): #10(1420), #11(46), #13(0)]
Hypertext Transfer Protocol
    HTTP/1.0 200 OK\r\n
    Date: Tue, 20 Mar 2012 00:08:40 GMT\r\n
    Expires: Tue, 20 Mar 2012 00:08:40 GMT\r\n
    Cache-Control: private, max-age=3600\r\n
    Content-Type: text/xml; charset=UTF-8\r\n
    Set-Cookie: PREF=ID=bdbc6074202b4f64:FF=0:TM=1332202120:LM=1332202120:S=IJPkYCntPGg4ULVC; expires=Thu, 20-Mar-2014 00:08:40 GMT; path=/; domain=.google.com\r\n
    Server: gws\r\n
    X-XSS-Protection: 1; mode=block\r\n
    X-Frame-Options: SAMEORIGIN\r\n
    \r\n
eXtensible Markup Language
    <?xml
    <toplevel>
